{"schema_version": "0.1", "action": "cleanup", "provider": "gcp", "environment_id": "railshot-sim-gcp-20261002080234", "status": "cleaned", "cluster_status": "api_ready", "cilium_status": "unknown", "workload_status": "absent", "endpoint": null, "endpoint_scope": null, "error": null, "states": [{"state": "NODE_READY", "timestamp": "2026-10-01T23:07:40.736677+00:00"}, {"state": "K3S_READY", "timestamp": "2026-10-01T23:07:40.796222+00:00"}]}
