{"schema_version": "0.1", "action": "cleanup", "provider": "openstack", "environment_id": "railshot-sim-openstack-20261002080234", "status": "cleaned", "cluster_status": "api_ready", "cilium_status": "unknown", "workload_status": "absent", "endpoint": null, "endpoint_scope": null, "error": null, "states": [{"state": "NODE_READY", "timestamp": "2026-10-01T23:10:25.669840+00:00"}, {"state": "K3S_READY", "timestamp": "2026-10-01T23:10:25.730823+00:00"}]}
