{"schema_version": "0.1", "action": "deploy", "provider": "gcp", "environment_id": "railshot-sim-gcp-20261002080234", "status": "ready", "cluster_status": "ready", "cilium_status": "healthy", "workload_status": "ready", "endpoint": "http://10.250.20.12:30080", "endpoint_scope": "node-local", "error": null, "states": [{"state": "NODE_READY", "timestamp": "2026-10-01T23:07:07.712272+00:00"}, {"state": "K3S_INSTALLING", "timestamp": "2026-10-01T23:07:07.712292+00:00"}, {"state": "K3S_READY", "timestamp": "2026-10-01T23:07:08.147080+00:00"}, {"state": "CILIUM_INSTALLING", "timestamp": "2026-10-01T23:07:08.147095+00:00"}, {"state": "CILIUM_READY", "timestamp": "2026-10-01T23:07:10.631810+00:00"}, {"state": "WORKLOAD_DEPLOYING", "timestamp": "2026-10-01T23:07:10.868847+00:00"}, {"state": "WORKLOAD_READY", "timestamp": "2026-10-01T23:07:11.248562+00:00"}, {"state": "ENDPOINT_READY", "timestamp": "2026-10-01T23:07:14.667673+00:00"}]}
