{"schema_version": "0.1", "action": "cleanup", "provider": "openstack", "environment_id": "railshot-runtime-demo", "status": "failed", "cluster_status": "unknown", "cilium_status": "unknown", "workload_status": "unknown", "endpoint": null, "endpoint_scope": null, "error": {"code": "DESTRUCTIVE_ACTION_REQUIRES_FLAG", "stage": "NODE_READY", "message": "Full cleanup requires --disposable-node", "exit_code": null, "diagnostics": null}, "states": [{"state": "FAILED", "timestamp": "2026-10-01T22:21:53.289463+00:00"}]}
