{"schema_version": "0.1", "action": "verify", "provider": "aws", "environment_id": "railshot-sim-aws-20261002080234", "status": "ready", "cluster_status": "ready", "cilium_status": "healthy", "workload_status": "ready", "endpoint": "http://10.250.10.11:30080", "endpoint_scope": "node-local", "error": null, "states": [{"state": "NODE_READY", "timestamp": "2026-10-01T23:04:41.919751+00:00"}, {"state": "K3S_READY", "timestamp": "2026-10-01T23:04:41.979341+00:00"}, {"state": "CILIUM_READY", "timestamp": "2026-10-01T23:04:43.049076+00:00"}, {"state": "WORKLOAD_READY", "timestamp": "2026-10-01T23:04:43.443419+00:00"}, {"state": "ENDPOINT_READY", "timestamp": "2026-10-01T23:04:46.828062+00:00"}]}
