{"schema_version": "0.1", "action": "cleanup", "provider": "aws", "environment_id": "railshot-sim-aws-20261002080234", "status": "cleaned", "cluster_status": "api_ready", "cilium_status": "unknown", "workload_status": "absent", "endpoint": null, "endpoint_scope": null, "error": null, "states": [{"state": "NODE_READY", "timestamp": "2026-10-01T23:04:47.288604+00:00"}, {"state": "K3S_READY", "timestamp": "2026-10-01T23:04:47.356370+00:00"}]}
