{"schema_version": "0.1", "action": "verify", "provider": "openstack", "environment_id": "railshot-runtime-demo", "status": "failed", "cluster_status": "api_ready", "cilium_status": "failed", "workload_status": "unknown", "endpoint": null, "endpoint_scope": null, "error": {"code": "COMMAND_FAILED", "stage": "CILIUM_READY", "message": "orkload   NodePort   10.43.4.182   <none>        80:30080/TCP   4m41s   railshot.io/app=railshot-workload\n\nNAME                                                     ADDRESSTYPE   PORTS   ENDPOINTS    AGE\nendpointslice.discovery.k8s.io/railshot-workload-5n958   IPv4          80      10.42.0.18   4m41s\nrailshot-workload-56b77967cd-rnrjj\napp:  \nrailshot-demo      21s         Normal    Created                          pod/railshot-check-c5cfc139               Created container: check\nrailshot-demo      21s         Normal    Pulled                           pod/railshot-check-c5cfc139               Container image \"curlimages/curl:8.12.1\" already present on machine\nkube-system        18s         Normal    Pulled                           pod/cilium-pgsfq                          Container image \"quay.io/cilium/cilium:v1.20.2@sha256:2939231d0d3e3ebddcd80fffa168b7ddcc78fdf0dc864d1c8c126ff523c54f01\" already present on machine\nkube-system        18s         Normal    Started                          pod/cilium-pgsfq                          Started container config\nkube-system        18s         Normal    Created                          pod/cilium-pgsfq                          Created container: config\nkube-system        18s         Normal    SuccessfulCreate                 daemonset/cilium                          Created pod: cilium-pgsfq\nkube-system        18s         Normal    Killing                          pod/cilium-q7h7g                          Stopping container cilium-agent\nkube-system        18s         Normal    SuccessfulDelete                 daemonset/cilium                          Deleted pod: cilium-q7h7g\nkube-system        17s         Normal    Pulled                           pod/cilium-pgsfq                          Container image \"quay.io/cilium/cilium:v1.20.2@sha256:2939231d0d3e3ebddcd80fffa168b7ddcc78fdf0dc864d1c8c126ff523c54f01\" already present on machine\nkube-system        17s         Normal    Created                          pod/cilium-pgsfq                          Created container: mount-cgroup\nkube-system        17s         Normal    Started                          pod/cilium-pgsfq                          Started container mount-cgroup\nkube-system        16s         Normal    Pulled                           pod/cilium-pgsfq                          Container image \"quay.io/cilium/cilium:v1.20.2@sha256:2939231d0d3e3ebddcd80fffa168b7ddcc78fdf0dc864d1c8c126ff523c54f01\" already present on machine\nkube-system        16s         Normal    Started                          pod/cilium-pgsfq                          Started container apply-sysctl-overwrites\nkube-system        16s         Normal    Created                          pod/cilium-pgsfq                          Created container: apply-sysctl-overwrites\nkube-system        15s         Normal    Created                          pod/cilium-pgsfq                          Created container: mount-bpf-fs\nkube-system        15s         Normal    Pulled                           pod/cilium-pgsfq                          Container image \"quay.io/cilium/cilium:v1.20.2@sha256:2939231d0d3e3ebddcd80fffa168b7ddcc78fdf0dc864d1c8c126ff523c54f01\" already present on machine\nkube-system        15s         Normal    Started                          pod/cilium-pgsfq                          Started container mount-bpf-fs\nkube-system        14s         Normal    Started                          pod/cilium-pgsfq                          Started container clean-cilium-state\nkube-system        14s         Normal    Pulled                           pod/cilium-pgsfq                          Container image \"quay.io/cilium/cilium:v1.20.2@sha256:2939231d0d3e3ebddcd80fffa168b7ddcc78fdf0dc864d1c8c126ff523c54f01\" already present on machine\nkube-system        14s         Normal    Created                          pod/cilium-pgsfq                          Created container: clean-cilium-state\nkube-system        13s         Normal    Started                          pod/cilium-pgsfq                          Started container install-cni-binaries\nkube-system        13s         Normal    Pulled                           pod/cilium-pgsfq                          Container image \"quay.io/cilium/cilium:v1.20.2@sha256:2939231d0d3e3ebddcd80fffa168b7ddcc78fdf0dc864d1c8c126ff523c54f01\" already present on machine\nkube-system        13s         Normal    Created                          pod/cilium-pgsfq                          Created container: install-cni-binaries\nkube-system        12s         Warning   InspectFailed                    pod/cilium-pgsfq                          Failed to apply default image tag \"invalid@@@\": couldn't parse image name \"invalid@@@\": invalid reference format\nkube-system        12s         Warning   Failed                           pod/cilium-pgsfq                          Error: InvalidImageName\n[2026-10-01T22:20:35Z] [health] 진단: journalctl -u k3s -n 100; k3s kubectl get pods -A -o wide; k3s kubectl get events -A --sort-by=.lastTimestamp", "exit_code": 1, "diagnostics": null}, "states": [{"state": "NODE_READY", "timestamp": "2026-10-01T22:20:17.173817+00:00"}, {"state": "K3S_READY", "timestamp": "2026-10-01T22:20:17.273003+00:00"}, {"state": "FAILED", "timestamp": "2026-10-01T22:20:35.420486+00:00"}]}
