{"schema_version": "0.1", "action": "cleanup", "provider": "gcp", "environment_id": "railshot-sim-gcp-20261002080234", "status": "cleaned", "cluster_status": "absent", "cilium_status": "absent", "workload_status": "absent", "endpoint": null, "endpoint_scope": null, "error": null, "states": [{"state": "NODE_READY", "timestamp": "2026-10-01T23:07:52.782528+00:00"}]}
