{"schema_version": "0.1", "action": "verify", "provider": "openstack", "environment_id": "railshot-runtime-demo", "status": "failed", "cluster_status": "ready", "cilium_status": "healthy", "workload_status": "failed", "endpoint": null, "endpoint_scope": null, "error": {"code": "OWNERSHIP_CONFLICT", "stage": "WORKLOAD_DEPLOYING", "message": "namespace/railshot-foreign: not owned by this Railshot environment", "exit_code": null, "diagnostics": null}, "states": [{"state": "NODE_READY", "timestamp": "2026-10-01T22:20:55.352570+00:00"}, {"state": "K3S_READY", "timestamp": "2026-10-01T22:20:55.412047+00:00"}, {"state": "CILIUM_READY", "timestamp": "2026-10-01T22:20:56.743887+00:00"}, {"state": "FAILED", "timestamp": "2026-10-01T22:20:56.926767+00:00"}]}
