{"schema_version": "0.1", "action": "cleanup", "provider": "aws", "environment_id": "railshot-ci-73a2e7255a543c39", "status": "cleaned", "cluster_status": "absent", "cilium_status": "absent", "workload_status": "absent", "endpoint": null, "endpoint_scope": null, "error": null, "states": [{"state": "NODE_READY", "timestamp": "2026-10-02T13:53:42.785320+00:00"}]}
