{"schema_version": "0.1", "action": "verify", "provider": "openstack", "environment_id": "railshot-runtime-demo", "status": "failed", "cluster_status": "ready", "cilium_status": "healthy", "workload_status": "ready", "endpoint": null, "endpoint_scope": null, "error": {"code": "SERVICE_DRIFT", "stage": "ENDPOINT_READY", "message": "Live Service does not match the requested NodePort/target/selector", "exit_code": null, "diagnostics": "27s         Normal    ScalingReplicaSet   deployment/railshot-workload              Scaled up replica set railshot-workload-686bbc7f9d from 0 to 1\n27s         Normal    SuccessfulCreate    replicaset/railshot-workload-686bbc7f9d   Created pod: railshot-workload-686bbc7f9d-2wtw2\n26s         Normal    Started             pod/railshot-workload-686bbc7f9d-2wtw2    Started container app\n26s         Normal    Pulled              pod/railshot-workload-686bbc7f9d-2wtw2    Container image \"nginx:1.28.0-alpine\" already present on machine\n26s         Normal    Created             pod/railshot-workload-686bbc7f9d-2wtw2    Created container: app\n7s          Warning   Unhealthy           pod/railshot-workload-686bbc7f9d-2wtw2    Startup probe failed: HTTP probe failed with statuscode: 404\n6s          Normal    Killing             pod/railshot-workload-686bbc7f9d-2wtw2    Stopping container app\n6s          Normal    SuccessfulDelete    replicaset/railshot-workload-686bbc7f9d   Deleted pod: railshot-workload-686bbc7f9d-2wtw2\n6s          Normal    ScalingReplicaSet   deployment/railshot-workload              Scaled down replica set railshot-workload-686bbc7f9d from 1 to 0\n5s          Normal    Pulled              pod/railshot-check-cedf0a84               Container image \"curlimages/curl:8.12.1\" already present on machine\n5s          Normal    Created             pod/railshot-check-cedf0a84               Created container: check\n5s          Normal    Started             pod/railshot-check-cedf0a84               Started container check"}, "states": [{"state": "NODE_READY", "timestamp": "2026-10-01T22:20:05.369451+00:00"}, {"state": "K3S_READY", "timestamp": "2026-10-01T22:20:05.441231+00:00"}, {"state": "CILIUM_READY", "timestamp": "2026-10-01T22:20:06.767854+00:00"}, {"state": "WORKLOAD_READY", "timestamp": "2026-10-01T22:20:07.237932+00:00"}, {"state": "FAILED", "timestamp": "2026-10-01T22:20:07.512332+00:00"}]}
