{"schema_version": "0.1", "action": "cleanup", "provider": "openstack", "environment_id": "railshot-runtime-demo", "status": "failed", "cluster_status": "api_ready", "cilium_status": "unknown", "workload_status": "failed", "endpoint": null, "endpoint_scope": null, "error": {"code": "OWNERSHIP_CONFLICT", "stage": "WORKLOAD_DEPLOYING", "message": "namespace/railshot-foreign: not owned by this Railshot environment", "exit_code": null, "diagnostics": null}, "states": [{"state": "NODE_READY", "timestamp": "2026-10-01T22:20:56.979775+00:00"}, {"state": "K3S_READY", "timestamp": "2026-10-01T22:20:57.042657+00:00"}, {"state": "FAILED", "timestamp": "2026-10-01T22:20:57.240047+00:00"}]}
