{"schema_version": "0.1", "action": "cleanup", "provider": "aws", "environment_id": "railshot-sim-aws-20261002080234", "status": "cleaned", "cluster_status": "absent", "cilium_status": "absent", "workload_status": "absent", "endpoint": null, "endpoint_scope": null, "error": null, "states": [{"state": "NODE_READY", "timestamp": "2026-10-01T23:04:59.883347+00:00"}]}
